{
  "id": "0192f3a1-7c2e-7b4d-9a10-3f6e2d8c1b01",
  "type": "text",
  "authorId": "0192f3a1-7c2e-7b4d-9a10-3f6e2d8c1a02",
  "createdAt": "2026-09-26T18:05:00Z",
  "title": "Le bal du 14 juillet",
  "text": "C'est là que j'ai rencontré votre grand-père.\nIl m'a marché sur les pieds toute la soirée.",
  "date": { "value": "1959-07-14" },
  "place": { "label": "Place de la mairie, Quimper", "lat": 47.996, "lon": -4.102 },
  "people": ["Jeanne", "Pierre"],
  "tags": ["rencontre", "jeunesse"],
  "prompt": "Comment as-tu rencontré ton mari ?"
}
