{
  "id": "0192f3a1-7c2e-7b4d-9a10-3f6e2d8c1b02",
  "type": "photo",
  "authorId": "0192f3a1-7c2e-7b4d-9a10-3f6e2d8c1a03",
  "createdAt": "2026-09-26T19:10:00Z",
  "title": "La photo du bal retrouvée",
  "text": "Trouvée dans la boîte à biscuits du grenier.",
  "date": { "value": "1959", "approximate": true, "label": "l'été 1959" },
  "replyTo": "0192f3a1-7c2e-7b4d-9a10-3f6e2d8c1b01",
  "media": [
    {
      "path": "media/0192f3a1-7c2e-7b4d-9a10-3f6e2d8c1c01.webp",
      "mimeType": "image/webp",
      "size": 184320,
      "sha256": "9f86d081884c7d659a2feaa0c55ad015a3bf4f1b2b0b822cd15d6c15b0f00a08",
      "width": 1600,
      "height": 1067,
      "caption": "Jeanne et Pierre, au premier plan"
    }
  ]
}
